{
  "schema_version": "trace_matrix/v1",
  "summary": {
    "requirements": 23,
    "ok": 23,
    "no_testplan": 0,
    "missing_test_impl": 0,
    "no_signal_link": 0
  },
  "requirements": [
    {
      "req_id": "REQ-001",
      "requirement": "The module shall accept input data on the clk1 domain with data_in_valid handshake and assert clk1_ready when ready to accept data.",
      "test_ids": [
        "T-001"
      ],
      "testcases": [
        "test_input_ready_behavior"
      ],
      "tb_signals": [
        "clk1",
        "clk1_ready",
        "clk1_rst_n",
        "clk2_ready",
        "data_in",
        "data_in_valid",
        "have_a",
        "hold_valid"
      ],
      "rtl_signals": [
        "clk1",
        "clk1_ready",
        "clk1_rst_n",
        "clk2_ready",
        "data_in",
        "data_in_valid",
        "have_a",
        "hold_valid"
      ],
      "missing_test_impl": [],
      "status": "OK"
    },
    {
      "req_id": "REQ-002",
      "requirement": "The module shall pack two input beats into one output word according to the PACK_ORDER parameter: - PACK_ORDER=0: Output {beat_a, beat_b} - PACK_ORDER=1: Output {beat_b, beat_a}",
      "test_ids": [
        "T-003"
      ],
      "testcases": [
        "test_packing_both_orders"
      ],
      "tb_signals": [
        "clk1",
        "clk1_ready",
        "clk1_rst_n",
        "clk2",
        "clk2_ready",
        "data_in",
        "data_in_valid"
      ],
      "rtl_signals": [
        "clk1",
        "clk1_ready",
        "clk1_rst_n",
        "clk2",
        "clk2_ready",
        "data_in",
        "data_in_valid"
      ],
      "missing_test_impl": [],
      "status": "OK"
    },
    {
      "req_id": "REQ-003",
      "requirement": "The module shall transfer packed words from the clk1 domain to the clk2 domain through an asynchronous FIFO.",
      "test_ids": [
        "T-012"
      ],
      "testcases": [
        "test_sustained_full_rate_transfer"
      ],
      "tb_signals": [
        "af_rd_valid",
        "clk1",
        "clk1_ready",
        "clk1_rst_n",
        "clk2",
        "clk2_ready",
        "data_in",
        "data_in_valid",
        "data_out_valid",
        "have_a",
        "hold_valid"
      ],
      "rtl_signals": [
        "af_rd_valid",
        "clk1",
        "clk1_ready",
        "clk1_rst_n",
        "clk2",
        "clk2_ready",
        "data_in",
        "data_in_valid",
        "data_out_valid",
        "have_a",
        "hold_valid"
      ],
      "missing_test_impl": [],
      "status": "OK"
    },
    {
      "req_id": "REQ-004",
      "requirement": "The module shall present output data on the clk2 domain with data_out_valid handshake and wait for clk2_ready before releasing the output.",
      "test_ids": [
        "T-012"
      ],
      "testcases": [
        "test_sustained_full_rate_transfer"
      ],
      "tb_signals": [
        "af_rd_valid",
        "clk1",
        "clk1_ready",
        "clk1_rst_n",
        "clk2",
        "clk2_ready",
        "data_in",
        "data_in_valid",
        "data_out_valid",
        "have_a",
        "hold_valid"
      ],
      "rtl_signals": [
        "af_rd_valid",
        "clk1",
        "clk1_ready",
        "clk1_rst_n",
        "clk2",
        "clk2_ready",
        "data_in",
        "data_in_valid",
        "data_out_valid",
        "have_a",
        "hold_valid"
      ],
      "missing_test_impl": [],
      "status": "OK"
    },
    {
      "req_id": "REQ-005",
      "requirement": "The module shall support independent asynchronous active-low resets for each clock domain (clk1_rst_n and clk2_rst_n).",
      "test_ids": [
        "T-014"
      ],
      "testcases": [
        "test_reset_initialization"
      ],
      "tb_signals": [
        "a_reg",
        "have_a",
        "hold_valid",
        "hold_word",
        "out_data_reg",
        "out_valid_reg"
      ],
      "rtl_signals": [
        "a_reg",
        "have_a",
        "hold_valid",
        "hold_word",
        "out_data_reg",
        "out_valid_reg"
      ],
      "missing_test_impl": [],
      "status": "OK"
    },
    {
      "req_id": "REQ-006",
      "requirement": "The module shall initialize all state registers to 0 after reset completion.",
      "test_ids": [
        "T-014"
      ],
      "testcases": [
        "test_reset_initialization"
      ],
      "tb_signals": [
        "a_reg",
        "have_a",
        "hold_valid",
        "hold_word",
        "out_data_reg",
        "out_valid_reg"
      ],
      "rtl_signals": [
        "a_reg",
        "have_a",
        "hold_valid",
        "hold_word",
        "out_data_reg",
        "out_valid_reg"
      ],
      "missing_test_impl": [],
      "status": "OK"
    },
    {
      "req_id": "REQ-007",
      "requirement": "The module shall abort all in-flight operations immediately upon reset assertion and discard all partial packets in the pack buffer.",
      "test_ids": [
        "T-015"
      ],
      "testcases": [
        "test_reset_during_active_transfer"
      ],
      "tb_signals": [
        "a_reg",
        "af_rd_valid",
        "clk1",
        "clk1_ready",
        "clk1_rst_n",
        "clk2",
        "clk2_ready",
        "clk2_rst_n",
        "data_in",
        "data_in_valid",
        "data_out_valid",
        "have_a",
        "hold_valid",
        "hold_word",
        "out_data_reg",
        "out_valid_reg"
      ],
      "rtl_signals": [
        "a_reg",
        "af_rd_valid",
        "clk1",
        "clk1_ready",
        "clk1_rst_n",
        "clk2",
        "clk2_ready",
        "clk2_rst_n",
        "data_in",
        "data_in_valid",
        "data_out_valid",
        "have_a",
        "hold_valid",
        "hold_word",
        "out_data_reg",
        "out_valid_reg"
      ],
      "missing_test_impl": [],
      "status": "OK"
    },
    {
      "req_id": "REQ-008",
      "requirement": "The module shall assert clk1_ready when have_a=0 (can accept first beat regardless of FIFO state).",
      "test_ids": [
        "T-001"
      ],
      "testcases": [
        "test_input_ready_behavior"
      ],
      "tb_signals": [
        "clk1",
        "clk1_ready",
        "clk1_rst_n",
        "clk2_ready",
        "data_in",
        "data_in_valid",
        "have_a",
        "hold_valid"
      ],
      "rtl_signals": [
        "clk1",
        "clk1_ready",
        "clk1_rst_n",
        "clk2_ready",
        "data_in",
        "data_in_valid",
        "have_a",
        "hold_valid"
      ],
      "missing_test_impl": [],
      "status": "OK"
    },
    {
      "req_id": "REQ-009",
      "requirement": "The module shall deassert clk1_ready when hold_valid=1 and have_a=1 (cannot accept second beat when hold buffer is occupied).",
      "test_ids": [
        "T-001"
      ],
      "testcases": [
        "test_input_ready_behavior"
      ],
      "tb_signals": [
        "clk1",
        "clk1_ready",
        "clk1_rst_n",
        "clk2_ready",
        "data_in",
        "data_in_valid",
        "have_a",
        "hold_valid"
      ],
      "rtl_signals": [
        "clk1",
        "clk1_ready",
        "clk1_rst_n",
        "clk2_ready",
        "data_in",
        "data_in_valid",
        "have_a",
        "hold_valid"
      ],
      "missing_test_impl": [],
      "status": "OK"
    },
    {
      "req_id": "REQ-010",
      "requirement": "The module shall store the first beat in a_reg and set have_a=1 when a beat is accepted while have_a=0.",
      "test_ids": [
        "T-002"
      ],
      "testcases": [
        "test_first_beat_storage"
      ],
      "tb_signals": [
        "a_reg",
        "clk1",
        "clk1_ready",
        "clk1_rst_n",
        "data_in",
        "data_in_valid",
        "have_a"
      ],
      "rtl_signals": [
        "a_reg",
        "clk1",
        "clk1_ready",
        "clk1_rst_n",
        "data_in",
        "data_in_valid",
        "have_a"
      ],
      "missing_test_impl": [],
      "status": "OK"
    },
    {
      "req_id": "REQ-011",
      "requirement": "The module shall pack the current beat with the stored beat from a_reg when a beat is accepted while have_a=1.",
      "test_ids": [
        "T-003"
      ],
      "testcases": [
        "test_packing_both_orders"
      ],
      "tb_signals": [
        "clk1",
        "clk1_ready",
        "clk1_rst_n",
        "clk2",
        "clk2_ready",
        "data_in",
        "data_in_valid"
      ],
      "rtl_signals": [
        "clk1",
        "clk1_ready",
        "clk1_rst_n",
        "clk2",
        "clk2_ready",
        "data_in",
        "data_in_valid"
      ],
      "missing_test_impl": [],
      "status": "OK"
    },
    {
      "req_id": "REQ-012",
      "requirement": "The module shall write the packed word to the FIFO when af_wr_ready is asserted.",
      "test_ids": [
        "T-004"
      ],
      "testcases": [
        "test_fifo_write_when_ready"
      ],
      "tb_signals": [
        "clk1",
        "clk1_ready",
        "clk1_rst_n",
        "clk2",
        "clk2_ready",
        "data_in",
        "data_in_valid",
        "hold_valid"
      ],
      "rtl_signals": [
        "clk1",
        "clk1_ready",
        "clk1_rst_n",
        "clk2",
        "clk2_ready",
        "data_in",
        "data_in_valid",
        "hold_valid"
      ],
      "missing_test_impl": [],
      "status": "OK"
    },
    {
      "req_id": "REQ-013",
      "requirement": "The module shall store the packed word in hold_word and set hold_valid=1 when af_wr_ready is deasserted at pack completion.",
      "test_ids": [
        "T-005"
      ],
      "testcases": [
        "test_hold_buffer_on_fifo_backpressure"
      ],
      "tb_signals": [
        "clk1",
        "clk1_ready",
        "clk1_rst_n",
        "clk2_ready",
        "data_in",
        "data_in_valid",
        "hold_valid",
        "hold_word"
      ],
      "rtl_signals": [
        "clk1",
        "clk1_ready",
        "clk1_rst_n",
        "clk2_ready",
        "data_in",